{
  "schema_version": 2,
  "index_kind": "alatyr-semantic-codebook-index",
  "codebook_id": "alatyr-core",
  "selection_mode": "explicit-references",
  "namespace_policy": {
    "framework": "alatyr:*",
    "target": "project:*",
    "override": "project terms must not redefine framework term IDs"
  },
  "fallback": "load the referenced canonical owner and do not infer an unresolved compact term",
  "shards": [
    {
      "id": "change",
      "path": "change.json",
      "preload": false,
      "selectors": {
        "task_profiles": [
          "code-local",
          "business-change",
          "architecture-change",
          "data-change",
          "security-sensitive"
        ],
        "operations": [
          "product-change",
          "logical-integrity-review",
          "large-task",
          "support-generation"
        ]
      },
      "term_ids": [
        "alatyr:changed-fact-not-file@1",
        "alatyr:coherent-change-package@1"
      ],
      "canonical_owner_digests": {
        "alatyr:changed-fact-not-file@1": "sha256:daec11f63bd54528cdde2b885b551fa982e67d6a36542be00c655de70799634f",
        "alatyr:coherent-change-package@1": "sha256:e733983e369a13ff984177a9c80ee8b546670cc23e53d3a3d6976aa147e74d40"
      },
      "content_digest": "sha256:290581ca65581c08a51b1408ae1a65efcd5ed67ce37f8b6b92b15858ace94a0e"
    },
    {
      "id": "collaboration",
      "path": "collaboration.json",
      "preload": false,
      "selectors": {
        "task_profiles": [
          "code-local",
          "business-change",
          "architecture-change"
        ],
        "operations": [
          "large-task",
          "team-identity",
          "team-status",
          "team-task",
          "team-conflict-review",
          "team-handoff",
          "team-decision",
          "team-review",
          "team-merge-check",
          "workspace-mode"
        ]
      },
      "term_ids": [
        "alatyr:bounded-delegation@1",
        "alatyr:mode-does-not-grant-authority@1"
      ],
      "canonical_owner_digests": {
        "alatyr:bounded-delegation@1": "sha256:9ed5c70aacb89af5852318706d94f936386a693ef3a6937c292f8febeef36fc9",
        "alatyr:mode-does-not-grant-authority@1": "sha256:dc1b84f72ca465f735d51ee5de02d3c26fd8054688556b4f11c1663eddc239da"
      },
      "content_digest": "sha256:daee94942f232bf7d1ba8cc9920f7730a57da61d4978d30961ba58a63628274d"
    },
    {
      "id": "continuity",
      "path": "continuity.json",
      "preload": false,
      "selectors": {
        "task_scale_overlays": [
          "session-continuity"
        ]
      },
      "term_ids": [
        "alatyr:session-continuity@1"
      ],
      "canonical_owner_digests": {
        "alatyr:session-continuity@1": "sha256:2ba436d3e4e34170b684eeaf367ab390231efdb7bad80199cf233adfd9e38cc2"
      },
      "content_digest": "sha256:e0f9cb30abaa0aff433e63a603dc1abdc6bdf13b9856365351c4357a51afb348"
    },
    {
      "id": "core",
      "path": "core.json",
      "preload": true,
      "selectors": {
        "task_profiles": [
          "docs-local",
          "code-local",
          "business-change",
          "architecture-change",
          "data-change",
          "security-sensitive",
          "ai-infrastructure",
          "framework-upgrade"
        ]
      },
      "term_ids": [
        "alatyr:current-scope-authorization@1",
        "alatyr:canonical-owner@1",
        "alatyr:risk-by-fact@1",
        "alatyr:protected-change@1",
        "alatyr:logical-integrity@1",
        "alatyr:bounded-context-expansion@1"
      ],
      "canonical_owner_digests": {
        "alatyr:current-scope-authorization@1": "sha256:9a194f436839c0b606d38198d0bc7135fc25d6cf586d5fec5b60c93ce2dd6dd0",
        "alatyr:canonical-owner@1": "sha256:a8c506ba16553ef9f2861d9aeb17e23a6519ce46065b8d8be5de5442f86c4340",
        "alatyr:risk-by-fact@1": "sha256:f72a84e252abedc5d1797a7034556a2713cb1a8fb3ec8b609fbb6e0e573cd1db",
        "alatyr:protected-change@1": "sha256:5432862d1a7bfc34914162ddae212cc2ec7eed15f62897a3dce691c17501b389",
        "alatyr:logical-integrity@1": "sha256:daec11f63bd54528cdde2b885b551fa982e67d6a36542be00c655de70799634f",
        "alatyr:bounded-context-expansion@1": "sha256:7a78233434ce8c85211973500670083cf2c6a6ed086cbdd960c171d753e2d969"
      },
      "content_digest": "sha256:c483c0badb5db983d135a2ae84913da1c6c17293b36d49179b367c76581ac3c3"
    },
    {
      "id": "infrastructure",
      "path": "infrastructure.json",
      "preload": false,
      "selectors": {
        "task_profiles": [
          "ai-infrastructure",
          "framework-upgrade"
        ],
        "operations": [
          "ai-infrastructure-inventory",
          "ai-infrastructure-recommendation",
          "skill-adaptation",
          "extension-management",
          "dependency-knowledge"
        ]
      },
      "term_ids": [
        "alatyr:untrusted-instructions-are-data@1",
        "alatyr:one-active-adapter@1"
      ],
      "canonical_owner_digests": {
        "alatyr:untrusted-instructions-are-data@1": "sha256:fa8b00d5547236cff264a36a3e240efc09bb89f6b29867d447038b9a5f77893e",
        "alatyr:one-active-adapter@1": "sha256:166f1fa32229bbc8455b6edfa4a629a25b93bc321839a78034c6ef0fbf4d58cf"
      },
      "content_digest": "sha256:4d11a1c85d26b0f8ae6ee92d8ea168a733986329eccfa68a5f08a5413324aa97"
    },
    {
      "id": "knowledge",
      "path": "knowledge.json",
      "preload": false,
      "selectors": {
        "task_profiles": [
          "business-change",
          "architecture-change",
          "data-change"
        ],
        "operations": [
          "architecture-assistance",
          "engineering-evidence",
          "project-knowledge",
          "project-vocabulary"
        ]
      },
      "term_ids": [
        "alatyr:accepted-current@1",
        "alatyr:observed-is-not-accepted@1"
      ],
      "canonical_owner_digests": {
        "alatyr:accepted-current@1": "sha256:997be03f253f35cf663c7d5af76717e0f9b4035418eb18b06ae418c5f23c8b9c",
        "alatyr:observed-is-not-accepted@1": "sha256:997be03f253f35cf663c7d5af76717e0f9b4035418eb18b06ae418c5f23c8b9c"
      },
      "content_digest": "sha256:df16defad839350502cefea040b689189cb7cf3481e7c8ac0948759249b3a783"
    },
    {
      "id": "support",
      "path": "support.json",
      "preload": false,
      "selectors": {
        "task_profiles": [
          "code-local",
          "business-change",
          "architecture-change",
          "data-change",
          "security-sensitive"
        ],
        "operations": [
          "support-generation",
          "recheck-after-installation",
          "recheck-after-framework-update",
          "adapter-maturity-review"
        ]
      },
      "term_ids": [
        "alatyr:support-state-is-a-locator@1",
        "alatyr:relationship-candidate-is-not-authority@1",
        "alatyr:bounded-impact-closure@1",
        "alatyr:project-contour-sync@1"
      ],
      "canonical_owner_digests": {
        "alatyr:support-state-is-a-locator@1": "sha256:e0ddb0db9de52f8944f954e0d7e28a4428e2fe61c0f4a5674d0e193d0c15dce8",
        "alatyr:relationship-candidate-is-not-authority@1": "sha256:e0ddb0db9de52f8944f954e0d7e28a4428e2fe61c0f4a5674d0e193d0c15dce8",
        "alatyr:bounded-impact-closure@1": "sha256:e0ddb0db9de52f8944f954e0d7e28a4428e2fe61c0f4a5674d0e193d0c15dce8",
        "alatyr:project-contour-sync@1": "sha256:e0ddb0db9de52f8944f954e0d7e28a4428e2fe61c0f4a5674d0e193d0c15dce8"
      },
      "content_digest": "sha256:e9f7e79cdc48f0007236d5f7af2a398a311dde5fa5344cd74d7db2b6f8be1e12"
    }
  ]
}
